sku,image_name,description,related_products
SHAN_ZAFRANI_GARAM_MASALA_50G,,"Indulge in the rich, aromatic warmth of SHAN_ZAFRANI_GARAM_MASALA_50G! This exquisite blend elevates your dishes with a symphony of spices, adding depth and complexity to curries, stews, and more.  Unleash the vibrant flavors of saffron and a perfectly balanced spice profile. Experience the difference authentic quality makes.


This 50g pack delivers a potent punch of flavor.  Key ingredients include premium saffron, cardamom, cloves, cinnamon, and black pepper.  Its finely ground texture ensures even distribution, maximizing flavor impact.  Perfect for both everyday cooking and special occasions.


Enhance your culinary creations with the authentic taste of SHAN.  Use sparingly to start, adjusting to your preference.   Add a touch of magic to your meals – order your SHAN_ZAFRANI_GARAM_MASALA_50G today!
",No related products found.
SHAN__KARAHI_FRY_GOSHAT_MASALA50_G,,"Unleash the authentic taste of India with Shan Karahi Fry Gosht Masala! This 50g pack delivers a rich, savory blend of spices perfect for creating tender, flavorful lamb karahi.  Experience restaurant-quality results at home with ease. Impress your family and friends with this aromatic and intensely delicious dish.  Enjoy the convenience of pre-mixed spices, saving you time and effort in the kitchen.


Our expertly crafted blend contains a unique combination of premium spices, including chilies, coriander, cumin, and more, meticulously balanced for that perfect karahi flavor.  Simply add to your favorite lamb recipe for a quick and easy meal.  50g net weight, perfect for one or two delicious servings. No artificial colors or flavors.


Elevate your cooking with Shan's authentic taste.  This masala is incredibly versatile – experiment with different cuts of meat or vegetables!  Order yours today and savor the rich, aromatic experience of homemade karahi.  Discover the difference quality spices make!
",SHAN_ZAFRANI_GARAM_MASALA_50G
Men_Black_Sports_Walking_Shoes,,"Conquer your daily walk in style and comfort with our Men's Black Sports Walking Shoes (SKU: Men_Black_Sports_Walking_Shoes)!  Experience superior cushioning and support for all-day wear, minimizing fatigue and maximizing your performance.  These shoes are designed for both athletic pursuits and casual outings, blending performance and everyday appeal.


Engineered with breathable mesh uppers for optimal ventilation and a durable rubber outsole for exceptional traction, these shoes offer a secure and comfortable fit.  They feature responsive cushioning in the midsole and a supportive insole for enhanced comfort.  The sleek black design complements any outfit.


Enjoy superior shock absorption, reducing stress on your joints.  Perfect for walking, light jogging, or everyday use.  Order your pair today and experience the difference!  Find your perfect fit and step into comfort.
",No related products found.
