sku,image_name,description,related_products
SHAN_ZAFRANI_GARAM_MASALA_50G,,"Unleash culinary magic with SHAN ZAFRANI GARAM MASALA! Elevate your dishes from ordinary to extraordinary. This exquisite blend adds warmth, depth, and authentic Indian flavor. Experience the aromatic symphony that will tantalize your taste buds and impress your guests. Infuse your cooking with a touch of luxury and create unforgettable meals. Transform everyday recipes into gourmet delights. Savor the rich, complex flavors that only Shan can deliver. Unlock a world of culinary possibilities and elevate your cooking game with this premium spice blend. It's the secret ingredient to making your dishes truly special, every single time.

Shan ZAFRANI GARAM MASALA boasts a meticulously crafted blend of premium spices, including saffron, cardamom, cinnamon, cloves, and more. Each spice is carefully selected and expertly ground to ensure optimal flavor and aroma. *Net Weight: 50g*. *SKU: SHAN_ZAFRANI_GARAM_MASALA_50G*. This versatile spice blend is perfect for a wide range of dishes, from curries and stews to biryanis and vegetable preparations. Its balanced flavor profile enhances the natural taste of your ingredients without overpowering them. Experience the difference that quality spices can make in your cooking. Elevate your culinary creations with this perfectly balanced spice blend.

Add a pinch of Shan ZAFRANI GARAM MASALA towards the end of cooking to preserve its delicate aroma. Experiment with different quantities to find your perfect flavor balance. Store in a cool, dry place for optimal freshness and longevity. Ready to transform your meals? Order your SHAN ZAFRANI GARAM MASALA (50g) today and embark on a flavorful journey! Experience the magic of authentic Indian cuisine in your own kitchen. Don't miss out on this opportunity to elevate your cooking and impress your friends and family. Start creating unforgettable meals today!
",SHAN__KARAHI_FRY_GOSHAT_MASALA50_G
SHAN__KARAHI_FRY_GOSHAT_MASALA50_G,,"Unleash authentic flavors with Shan Karahi Fry Goshat Masala! This 50g pack is your secret to restaurant-quality Karahi Gosht at home. Enjoy rich, aromatic, and perfectly balanced spices, simplifying your cooking process and delivering a mouthwatering experience every time. Skip complicated recipes; create culinary magic effortlessly! It's the perfect blend for a truly unforgettable dish, guaranteed to impress family and friends. Savor the taste of tradition with unparalleled convenience.

Shan Karahi Fry Goshat Masala features:
* A precise blend of premium spices, expertly crafted for optimal flavor.
* 50g pack, ideal for a single, flavorful Karahi Gosht preparation.
* Authentic recipe ensuring traditional taste.
* Easy-to-use, reducing cooking time and complexity.
* High-quality ingredients, delivering consistent results.
This masala guarantees a delightful and satisfying meal.

Transform your kitchen into a gourmet paradise. Simply follow the easy instructions on the pack for a delicious and authentic Karahi Gosht. Add your personal touch and enjoy the compliments! Don't wait, elevate your cooking today! Get your Shan Karahi Fry Goshat Masala now and experience the difference. Perfect for busy weeknights or special occasions. Taste the tradition, share the joy! Make every meal a celebration!
",SHAN_ZAFRANI_GARAM_MASALA_50G
Men_Black_Sports_Walking_Shoes,,"Step into ultimate comfort with Men_Black_Sports_Walking_Shoes! Experience superior support and effortless style whether you're hitting the gym, pounding the pavement, or simply enjoying a leisurely stroll. These shoes are designed to enhance your active lifestyle, providing unparalleled cushioning and stability for every stride. Feel the difference with shoes engineered for performance and designed for everyday wear. Unlock your potential and conquer your fitness goals with these versatile and stylish walking shoes. Get ready to experience a new level of comfort and performance!

These black sports walking shoes boast a breathable mesh upper, ensuring optimal ventilation to keep your feet cool and dry. Key features include:
* Lightweight design for effortless movement
* Durable rubber outsole for excellent traction
* Cushioned insole for superior comfort
* Reinforced heel for added stability.
The sleek black design complements any outfit, making them perfect for both workouts and casual wear. Experience the perfect blend of functionality and style with these meticulously crafted walking shoes. They are built to last, providing long-lasting comfort and support for all your adventures.

Enjoy enhanced comfort and performance. Perfect for daily walks, gym workouts, or running errands. Easy to clean and maintain. Get yours today and experience the ultimate in walking comfort!
",No related products found.
